{
  "schema_version": 1,
  "id": "walls-closed-footprint-confirm-joins",
  "rev": 1,
  "kind": "howto",
  "title": "Model a closed rectangular wall footprint and confirm its corners are allowed to join",
  "task": "Create four walls forming a closed rectangular loop on a level, then confirm that each wall's ends are allowed to join at the corners. Use WallUtils to check joins, not JoinGeometryUtils.",
  "queries": {
    "miss": [
      {
        "text": "join walls at corner",
        "tool": "search_functions",
        "surfaced": "mostly BuiltInParameter and PostableCommand noise; JoinGeometryUtils did not appear",
        "ranker": "keyword-fallback"
      }
    ],
    "hit": [
      {
        "text": "AreElementsJoined geometry",
        "tool": "search_functions",
        "rank": 1,
        "ranker": "keyword-fallback"
      }
    ]
  },
  "members": [
    "Autodesk.Revit.DB.Wall.Create",
    "Autodesk.Revit.DB.WallUtils.IsWallJoinAllowedAtEnd",
    "Autodesk.Revit.DB.Line.CreateBound",
    "Autodesk.Revit.DB.LocationCurve.Curve",
    "Autodesk.Revit.DB.Document.Regenerate"
  ],
  "script_language": "csharp-script",
  "script": "var doc = Document;\nvar level = Autodesk.Revit.DB.Level.Create(doc, 0.0);\nAutodesk.Revit.DB.WallType wallType = null;\nforeach (Autodesk.Revit.DB.WallType wt in new Autodesk.Revit.DB.FilteredElementCollector(doc).OfClass(typeof(Autodesk.Revit.DB.WallType))) {\n  if (wt.Kind == Autodesk.Revit.DB.WallKind.Basic) { wallType = wt; break; }\n}\n\nvar p1 = new Autodesk.Revit.DB.XYZ(0, 0, 0);\nvar p2 = new Autodesk.Revit.DB.XYZ(20, 0, 0);\nvar p3 = new Autodesk.Revit.DB.XYZ(20, 15, 0);\nvar p4 = new Autodesk.Revit.DB.XYZ(0, 15, 0);\n\nvar w1 = Autodesk.Revit.DB.Wall.Create(doc, Autodesk.Revit.DB.Line.CreateBound(p1, p2), wallType.Id, level.Id, 10.0, 0.0, false, false);\nvar w2 = Autodesk.Revit.DB.Wall.Create(doc, Autodesk.Revit.DB.Line.CreateBound(p2, p3), wallType.Id, level.Id, 10.0, 0.0, false, false);\nvar w3 = Autodesk.Revit.DB.Wall.Create(doc, Autodesk.Revit.DB.Line.CreateBound(p3, p4), wallType.Id, level.Id, 10.0, 0.0, false, false);\nvar w4 = Autodesk.Revit.DB.Wall.Create(doc, Autodesk.Revit.DB.Line.CreateBound(p4, p1), wallType.Id, level.Id, 10.0, 0.0, false, false);\ndoc.Regenerate();\n\nvar walls = new[] { w1, w2, w3, w4 };\nvar allEndsAllowJoin = true;\nforeach (var w in walls) {\n  if (!Autodesk.Revit.DB.WallUtils.IsWallJoinAllowedAtEnd(w, 0)) allEndsAllowJoin = false;\n  if (!Autodesk.Revit.DB.WallUtils.IsWallJoinAllowedAtEnd(w, 1)) allEndsAllowJoin = false;\n}\n\nvar loopCloses =\n  ((Autodesk.Revit.DB.LocationCurve)w1.Location).Curve.GetEndPoint(1).IsAlmostEqualTo(((Autodesk.Revit.DB.LocationCurve)w2.Location).Curve.GetEndPoint(0)) &&\n  ((Autodesk.Revit.DB.LocationCurve)w2.Location).Curve.GetEndPoint(1).IsAlmostEqualTo(((Autodesk.Revit.DB.LocationCurve)w3.Location).Curve.GetEndPoint(0)) &&\n  ((Autodesk.Revit.DB.LocationCurve)w3.Location).Curve.GetEndPoint(1).IsAlmostEqualTo(((Autodesk.Revit.DB.LocationCurve)w4.Location).Curve.GetEndPoint(0)) &&\n  ((Autodesk.Revit.DB.LocationCurve)w4.Location).Curve.GetEndPoint(1).IsAlmostEqualTo(((Autodesk.Revit.DB.LocationCurve)w1.Location).Curve.GetEndPoint(0));\n\nreturn new { wallTypeFound = wallType != null, wallCount = walls.Length, loopCloses, allEndsAllowJoin };\n",
  "pitfalls": [
    {
      "symptom": "JoinGeometryUtils.AreElementsJoined returns false for freshly created walls that visibly meet at their corners, so the task looks failed.",
      "cause": "AreElementsJoined reports geometry joins (the Join Geometry command's effect), which newly created walls do not have; wall-end joins are a different mechanism.",
      "fix": "Ask WallUtils.IsWallJoinAllowedAtEnd(wall, 0) and (wall, 1) for each wall; that is what 'do the corners join' means for walls.",
      "members": [
        "Autodesk.Revit.DB.JoinGeometryUtils.AreElementsJoined",
        "Autodesk.Revit.DB.WallUtils.IsWallJoinAllowedAtEnd"
      ]
    }
  ],
  "tags": [
    "walls",
    "creation",
    "joins",
    "geometry"
  ],
  "provenance": {
    "kind": "validation-corpus",
    "ref": "revit/test-harness/validation_corpus_test.go TestValidationCorpus_ClosedRectangularFootprint (validation-corpus case #2)"
  },
  "created_at": "2026-09-01T00:00:00Z",
  "updated_at": "2026-09-01T00:00:00Z"
}
